{
  "key": "fork-example",
  "id": "test.fork-example",
  "version": "0.1.0",
  "profile": "https://serverlessworkflow.io/specification/1.0.3",
  "queryLanguage": "jq",
  "initial": "raiseAlarm",
  "states": {
    "raiseAlarm": {
      "invoke": [
        {
          "src": "serverlessworkflow.fork",
          "input": {
            "compete": true,
            "branches": [
              {
                "callNurse": {
                  "call": "http",
                  "with": {
                    "method": "put",
                    "endpoint": "https://fake-hospital.com/api/v3/alert/nurses",
                    "body": {
                      "patientId": "{{ .patient.fullName }}",
                      "room": "{{ .room.number }}"
                    }
                  }
                }
              },
              {
                "callDoctor": {
                  "call": "http",
                  "with": {
                    "method": "put",
                    "endpoint": "https://fake-hospital.com/api/v3/alert/doctor",
                    "body": {
                      "patientId": "{{ .patient.fullName }}",
                      "room": "{{ .room.number }}"
                    }
                  }
                }
              }
            ]
          },
          "onDone": {
            "target": "done"
          }
        }
      ]
    },
    "done": {
      "type": "final"
    }
  },
  "meta": {
    "serverlessworkflow": {
      "source": "fork.yaml",
      "document": {
        "dsl": "1.0.3",
        "namespace": "test",
        "name": "fork-example",
        "version": "0.1.0"
      }
    }
  }
}
