{
  "key": "bearer-auth",
  "id": "examples.bearer-auth",
  "version": "0.1.0",
  "profile": "https://serverlessworkflow.io/specification/1.0.3",
  "queryLanguage": "jq",
  "initial": "getNotifications",
  "states": {
    "getNotifications": {
      "invoke": [
        {
          "src": "serverlessworkflow.call",
          "input": {
            "call": "asyncapi",
            "with": {
              "document": {
                "endpoint": "https://fake.com/docs/asyncapi.json"
              },
              "operation": "getNotifications",
              "protocol": "ws",
              "subscription": {
                "filter": "{{ .correlationId == $context.userId and .payload.from.firstName == $context.contact.firstName and .payload.from.lastName == $context.contact.lastName }}",
                "consume": {
                  "amount": 5
                }
              }
            }
          },
          "onDone": {
            "target": "done"
          }
        }
      ]
    },
    "done": {
      "type": "final"
    }
  },
  "meta": {
    "serverlessworkflow": {
      "source": "call-asyncapi-subscribe-consume-amount.yaml",
      "document": {
        "dsl": "1.0.3",
        "namespace": "examples",
        "name": "bearer-auth",
        "version": "0.1.0"
      }
    }
  }
}
